{
  "event": "key_links:delete",
  "message": "john.smith unlinked 1 key from key application.modal.header in project Translation Project within branch new-feature-1",
  "sent_at": "2025-08-17 14:59:05 UTC",
  "user": {
    "id": "24b9a53ad72e198ca332fba91bb95f57",
    "username": "john.smith",
    "name": "John Smith",
    "gravatar_uid": "1bc5edb4799fd8eec67c66122f47eb73"
  },
  "project": {
    "id": "b2abd3bd2c23ff0ac546e0a2d9aa0be1",
    "name": "Translation Project",
    "slug": "translation-project",
    "main_format": "yml",
    "project_image_url": null,
    "created_at": "2025-02-07 16:18:13 UTC",
    "updated_at": "2025-02-07 16:18:13 UTC",
    "point_of_contact": null
  },
  "branch": {
    "name": "new-feature-1"
  },
  "parent_key": {
    "id": "fe5b97045d80f91dd950b695d5ebe607",
    "name": "application.modal.header",
    "plural": false,
    "use_ordinal_rules": false,
    "data_type": "string",
    "tags": [
      "web"
    ]
  },
  "children": [
    {
      "id": "0c1a6e2a6f0e4d6d9c1d6a2f6e0b8c4a",
      "name": "application.modal.body"
    }
  ]
}
